GO:0035580,"The volume enclosed by the membrane of a specific granule, a granule with a membranous, tubular internal structure, found primarily in mature neutrophil cells. Most are released into the extracellular fluid. Specific granules contain lactoferrin, lysozyme, vitamin B12 binding protein and elastase."
GO:0035578,"The volume enclosed by the membrane of an azurophil granule, a primary lysosomal granule found in neutrophil granulocytes that contains a wide range of hydrolytic enzymes and is released into the extracellular fluid."
GO:0031905,"The volume enclosed by the membrane of an early endosome."
GO:0031093,"The volume enclosed by the membrane of the platelet alpha granule."
GO:0005788,"The volume enclosed by the membranes of the endoplasmic reticulum."
GO:0005902,"Thin cylindrical membrane-covered projections on the surface of an animal cell containing a core bundle of actin filaments. Present in especially large numbers on the absorptive surface of intestinal cells."
GO:0030175,"Thin, stiff, actin-based protrusion extended by the leading edge of a motile cell such as a crawling fibroblast or amoeba, or an axonal or dendritic growth cone, or a dendritic shaft."
